{
  "schema": "glaeda-cmux-fleet-enrollment/v1",
  "nodeId": "cmux-example-linux-001",
  "architecture": "x86_64",
  "os": {
    "family": "linux",
    "versionClass": "ubuntu-24.04"
  },
  "hardwareCapabilityClass": "cmux-linux-ci-medium",
  "supportedToolchainGenerations": [
    "sha256:cccccccccccccccccccccccccccccccccccccccccccccccccccccccccccccccc"
  ],
  "allowedExecutionRoles": [
    "cmux_linux_ci"
  ],
  "operatorFleetScope": "cmux-founders",
  "enrollmentGeneration": 1,
  "glaedaGeneration": "sha256:dddddddddddddddddddddddddddddddddddddddddddddddddddddddddddddddd",
  "state": "enrolling",
  "quarantineReason": null,
  "roleProfiles": {
    "cmux_linux_ci": {
      "id": "cmux.ci.guard",
      "generation": 1
    }
  }
}
